{"schemaVersion":"1.0","traceId":"synthetic-multi-event","algorithm":{"name":"progresstrace-baseline-comparator","version":"1.0.0"},"baselineSource":{"producerType":"harness","producerName":"example-harness","producerVersion":"2.3.0","evidenceBasis":"historical-analysis"},"terminationEventId":"event-002","terminationKind":"timeout","terminationAttested":true,"terminationRank":1,"observedEventCount":2,"obligationComparisons":[{"obligationId":"obl-a","outcome":"stable-attainment","eventBudget":10,"applicability":"not-applicable-stable-attainment","authoredEstimateUnusedEventBudget":null},{"obligationId":"obl-b","outcome":"unmet-target-at-termination","eventBudget":1,"applicability":"budget-exceeded","authoredEstimateUnusedEventBudget":null}],"authoredEstimateFalseHaltPresent":false,"maxAuthoredEstimateUnusedEventBudget":null}
