{"schemaVersion":"1.0","traceId":"redacted-phase-2b-task-contract-materialization","algorithm":{"name":"progresstrace-baseline-comparator","version":"1.0.0"},"baselineSource":{"producerType":"adapter","producerName":"reference-adapter-v0","producerVersion":"0","evidenceBasis":"adapter-inference"},"terminationEventId":"event-003","terminationKind":"natural-completion","terminationAttested":true,"terminationRank":2,"observedEventCount":3,"obligationComparisons":[{"obligationId":"task-contract-materialization","outcome":"stable-attainment","eventBudget":3,"applicability":"not-applicable-stable-attainment","authoredEstimateUnusedEventBudget":null}],"authoredEstimateFalseHaltPresent":false,"maxAuthoredEstimateUnusedEventBudget":null}
