{"schemaVersion":"1.0","traceId":"redacted-phase-2b-semantic-review-and-integration","algorithm":{"name":"progresstrace-baseline-comparator","version":"1.0.0"},"baselineSource":{"producerType":"adapter","producerName":"reference-adapter-v0","producerVersion":"0","evidenceBasis":"adapter-inference"},"terminationEventId":"event-004","terminationKind":"natural-completion","terminationAttested":true,"terminationRank":3,"observedEventCount":4,"obligationComparisons":[{"obligationId":"semantic-review","outcome":"stable-attainment","eventBudget":4,"applicability":"not-applicable-stable-attainment","authoredEstimateUnusedEventBudget":null},{"obligationId":"integration","outcome":"stable-attainment","eventBudget":4,"applicability":"not-applicable-stable-attainment","authoredEstimateUnusedEventBudget":null},{"obligationId":"hosted-verification","outcome":"stable-attainment","eventBudget":4,"applicability":"not-applicable-stable-attainment","authoredEstimateUnusedEventBudget":null}],"authoredEstimateFalseHaltPresent":false,"maxAuthoredEstimateUnusedEventBudget":null}
