{"schemaVersion":"1.0","traceId":"synthetic-non-contiguous","algorithm":{"name":"progresstrace-baseline-comparator","version":"1.0.0"},"baselineSource":{"producerType":"operator","producerName":"release-operator-role","producerVersion":null,"evidenceBasis":"historical-analysis"},"terminationEventId":"nc-evt-3","terminationKind":"timeout","terminationAttested":true,"terminationRank":3,"observedEventCount":4,"obligationComparisons":[{"obligationId":"obl-a","outcome":"unmet-target-at-termination","eventBudget":10,"applicability":"unused-authored-budget","authoredEstimateUnusedEventBudget":6},{"obligationId":"obl-b","outcome":"unmet-target-at-termination","eventBudget":7,"applicability":"unused-authored-budget","authoredEstimateUnusedEventBudget":3}],"authoredEstimateFalseHaltPresent":true,"maxAuthoredEstimateUnusedEventBudget":6}
