{"schemaVersion":"1.0","traceId":"redacted-phase-2b-codex-build-path-policy-recovery","algorithm":{"name":"progresstrace-baseline-comparator","version":"1.0.0"},"baselineSource":{"producerType":"adapter","producerName":"reference-adapter-v0","producerVersion":"0","evidenceBasis":"adapter-inference"},"terminationEventId":"event-003","terminationKind":"harness-declared-stop","terminationAttested":true,"terminationRank":2,"observedEventCount":3,"obligationComparisons":[{"obligationId":"implementation","outcome":"stable-attainment","eventBudget":4,"applicability":"not-applicable-stable-attainment","authoredEstimateUnusedEventBudget":null},{"obligationId":"path-policy","outcome":"unmet-target-at-termination","eventBudget":3,"applicability":"budget-exhausted-exactly","authoredEstimateUnusedEventBudget":0}],"authoredEstimateFalseHaltPresent":false,"maxAuthoredEstimateUnusedEventBudget":null}
