{"schemaVersion":"1.0","traceId":"synthetic-multi-event","algorithm":{"name":"progresstrace-baseline-comparator","version":"1.0.0"},"baselineSource":{"producerType":"agent","producerName":"example-agent","producerVersion":"1.0.0","evidenceBasis":"agent-estimate"},"terminationEventId":"event-002","terminationKind":"timeout","terminationAttested":true,"terminationRank":1,"observedEventCount":2,"obligationComparisons":[{"obligationId":"obl-a","outcome":"stable-attainment","eventBudget":10,"applicability":"not-applicable-stable-attainment","authoredEstimateUnusedEventBudget":null},{"obligationId":"obl-b","outcome":"unmet-target-at-termination","eventBudget":5,"applicability":"unused-authored-budget","authoredEstimateUnusedEventBudget":3}],"authoredEstimateFalseHaltPresent":true,"maxAuthoredEstimateUnusedEventBudget":3}
