{"schemaVersion":"1.0","traceId":"synthetic-multi-event","algorithm":{"name":"progresstrace-baseline-comparator","version":"1.0.0"},"baselineSource":{"producerType":"adapter","producerName":"example-otel-adapter","producerVersion":"0.9.1","evidenceBasis":"adapter-inference"},"terminationEventId":"event-002","terminationKind":"timeout","terminationAttested":true,"terminationRank":1,"observedEventCount":2,"obligationComparisons":[{"obligationId":"obl-a","outcome":"stable-attainment","eventBudget":10,"applicability":"not-applicable-stable-attainment","authoredEstimateUnusedEventBudget":null},{"obligationId":"obl-b","outcome":"unmet-target-at-termination","eventBudget":2,"applicability":"budget-exhausted-exactly","authoredEstimateUnusedEventBudget":0}],"authoredEstimateFalseHaltPresent":false,"maxAuthoredEstimateUnusedEventBudget":null}
