{"schemaVersion":"1.0","traceId":"synthetic-multi-event","algorithm":{"name":"progresstrace-baseline-comparator","version":"1.0.0"},"baselineSource":{"producerType":"operator","producerName":"release-operator-role","producerVersion":null,"evidenceBasis":"operator-estimate"},"terminationEventId":"event-002","terminationKind":"natural-completion","terminationAttested":true,"terminationRank":1,"observedEventCount":2,"obligationComparisons":[{"obligationId":"obl-a","outcome":"stable-attainment","eventBudget":10,"applicability":"not-applicable-stable-attainment","authoredEstimateUnusedEventBudget":null}],"authoredEstimateFalseHaltPresent":false,"maxAuthoredEstimateUnusedEventBudget":null}
