{"schemaVersion":"1.0","traceId":"synthetic-multi-event","algorithm":{"name":"progresstrace-baseline-comparator","version":"1.0.0"},"baselineSource":{"producerType":"harness","producerName":"example-harness","producerVersion":"2.3.0","evidenceBasis":"harness-policy"},"terminationEventId":"event-002","terminationKind":"capture-truncated","terminationAttested":false,"terminationRank":1,"observedEventCount":2,"obligationComparisons":[{"obligationId":"obl-a","outcome":"stable-attainment","eventBudget":5,"applicability":"incomplete-observation","authoredEstimateUnusedEventBudget":null},{"obligationId":"obl-b","outcome":"unmet-target-at-termination","eventBudget":5,"applicability":"incomplete-observation","authoredEstimateUnusedEventBudget":null}],"authoredEstimateFalseHaltPresent":false,"maxAuthoredEstimateUnusedEventBudget":null}
