{"schemaVersion":"1.0","traceId":"redacted-phase-2b-architecture-discovery","algorithm":{"name":"progresstrace-baseline-comparator","version":"1.0.0"},"baselineSource":{"producerType":"adapter","producerName":"reference-adapter-v0","producerVersion":"0","evidenceBasis":"adapter-inference"},"terminationEventId":"event-002","terminationKind":"natural-completion","terminationAttested":true,"terminationRank":1,"observedEventCount":2,"obligationComparisons":[{"obligationId":"architecture-discovery","outcome":"stable-attainment","eventBudget":2,"applicability":"not-applicable-stable-attainment","authoredEstimateUnusedEventBudget":null}],"authoredEstimateFalseHaltPresent":false,"maxAuthoredEstimateUnusedEventBudget":null}
